{"schema_version":1,"registry_role":"base-shared-skill-router","routing_policy":{"load_all_skills":false,"default_selection":"automatic-trigger-match","automatic_selection":true,"user_skill_declaration_required":false,"require_trigger_match":true,"require_execution_report":true,"work_modes":["PLAN","BUILD","REVIEW"],"max_primary_discipline_skills":1,"max_foundation_skills":3,"exclude_statuses":["HOLD","BACKUP","REMOVAL_CANDIDATE"]},"skills":[{"skill_id":"managing-project-intake-and-work-contract","layer":"foundation","discipline":"planning-project-operations","path":"skills/managing-project-intake-and-work-contract/SKILL.md","status":"ACTIVE","load_by_default":false,"trigger_tags":["new-request","cross-discipline","ambiguous-scope","material-ambiguity","grill-me","decision-interview","work-order","acceptance-criteria","work-decomposition","task-breakdown","dependency-map","execution-sequence","parallel-plan","cold-start","work-mode-selection","automatic-skill-routing","skill-execution-report","current-confirmed-decisions","duplicate-question-prevention","recommended-default","pr-preflight","approval-bundle","duplicate-omission-conflict-audit","planning-sequence","image-approval-bundle","instruction-authority","interface-first-prompt","context-curation","artifact-first-delivery","repository-first-workspace","repository-human-projection","benchmark-preflight","benchmark-reverse-engineering","legacy-context-hygiene","legacy-sheet-migration","feature-code-contract-modularity","feature-contract-change","feature-boundary-change"],"use_when":["새 요청과 중요 기획 질문을 라우팅할 때 최신 main·CURRENT_CONFIRMED_DECISIONS·분야 정본·동일 Goal의 open/recent PR backlog·repository human projection을 비교하고, L1+면 benchmark preflight receipt와 legacy context/configuration hygiene를 확인해 실행 계약으로 만든다. V4 Notion exception은 명시된 scope에서만 추가 대조하며 Google Sheets는 UNIQUE 미이관 정보가 있는 migration scope에서만 읽는다.","새 기능 또는 기능 계약·공개 경계·상태 소유권·consumer 연결의 의미 변경은 작업 크기·단계 수와 무관하게 intake와 기존 기능 계약 reference를 사용한다."],"do_not_use_when":["L0 수정, 기능 계약·공개 경계 변경이 없는 승인된 작은 구현, 입력이 같은 검사 재실행 또는 이미 유효한 실행 순서가 있고 기능 경계가 변하지 않는 작업이다."],"learning_log":"skills/SKILL_LEARNING_LOG.md","review_triggers":["오라우팅","사용자에게 Skill 선택 전가","Work Mode와 Skill Mode 혼용","사용 이유·결과 보고 누락","반복 질문","사용자 확인 없는 실행","계약 요구 손실","동사만 있는 작업 목록","의존성 누락","과도한 병렬화","불필요한 Foundation 연쇄 호출","기존 Decision을 다시 질문함","기술 기본값을 사용자에게 전가함","baseline audit missing","duplicate work","consumer propagation missing","hard constraint weakened","user decision hidden as default","context counterevidence removed","artifact claim overreach","main·PR·repository human projection 사전 대조 누락","repository human projection sync 누락","legacy Sheet를 active workspace로 되살림"],"last_reviewed_at":"2026-08-19","last_reviewed_commit":"e8730f8f1804fa951260713f0e6d7f9220c62f4b","knowledge_state":"PATTERN"},{"skill_id":"managing-game-project-operating-system","layer":"foundation","discipline":"project-operations-integrated-review","path":"skills/managing-game-project-operating-system/SKILL.md","status":"ACTIVE","load_by_default":false,"trigger_tags":["new-project","missing-operating-system","existing-project","safe-migration","document-restructure","operating-system-health","post-migration","major-gate","cold-start-failure","legacy-file","versioned-duplicate","stale-copy","obsolete-file","legacy-reconciliation","current-confirmed-decisions","decision-recovery","project-cold-start","visual-workflow-install","project-base-adapter","project-operating-integrity","repository-first-workspace","repository-human-projection","benchmark-preflight","benchmark-reverse-engineering","legacy-context-hygiene","legacy-sheet-migration"],"use_when":["프로젝트 운영체계를 설치·감사·마이그레이션·검증하면서 CURRENT_CONFIRMED_DECISIONS, open/recent PR backlog, 분야 정본, GitHub main과 exact-SHA repository human projection의 결정·구현·human-facing sync를 복원한다. V4 Notion exception은 명시된 scope에서만 추가 readback하며 Google Sheets는 migration-only legacy source다."],"do_not_use_when":["운영체계와 무관한 L0·작은 구현 작업이거나 현행 정본과 참조가 이미 명확한 단일 파일 편집이다."],"learning_log":"skills/SKILL_LEARNING_LOG.md","review_triggers":["승인 전 구조 변경","구형 파일 오삭제","고유 정보 유실","참조 경로 파손","호환 stub 누락","설치 누락","콜드 스타트 실패","파이프라인 실패","CURRENT_CONFIRMED_DECISIONS 설치 누락","콜드 스타트에서 승인 Decision 복원 실패","repository human projection readback 누락","repository/human-facing authority drift","legacy Sheet active authority 부활"],"last_reviewed_at":"2026-08-19","last_reviewed_commit":"e8730f8f1804fa951260713f0e6d7f9220c62f4b","knowledge_state":"PATTERN"},{"skill_id":"evolving-project-discipline-skills","layer":"foundation","discipline":"project-operations","path":"skills/evolving-project-discipline-skills/SKILL.md","status":"ACTIVE","load_by_default":false,"trigger_tags":["skill-audit","skill-learning","skill-consolidation","missing-discipline-skill","repeated-work","skill-creator","reusable-automation"],"use_when":["분야별·foundation 스킬을 생성·통합·학습·갱신하고 통합 뒤 오래된 ID·경로·참조 누락을 검증한다.","반복 작업을 기존 설정·자동화 모듈·reference·독립 Skill 중 적합한 최소 단위로 만들고 실제 제공되는 skill-creator를 재사용한다."],"do_not_use_when":["스킬 구조에 영향 없는 일반 구현 작업이다."],"learning_log":"skills/SKILL_LEARNING_LOG.md","review_triggers":["반복 실패","중복 스킬","새 작업 유형","검증 경로 변경","통합 뒤 오래된 참조 잔존"],"last_reviewed_at":"2026-09-16","last_reviewed_commit":"7ff0f4c117589156f617750a2421dfcebfe6ca6d","knowledge_state":"PATTERN"},{"skill_id":"managing-design-documents","layer":"foundation","discipline":"planning-documentation-publication","path":"skills/managing-design-documents/SKILL.md","status":"ACTIVE","load_by_default":false,"trigger_tags":["design-document","responsibility-map","roadmap-structure","pdf-publication","publication-stale","approved-image-change","document-restructure","decision-tracking","subsystem-checkpoint","canonical-integration","confirmed-decision-sync","duplicate-question-prevention","immediate-canonical-promotion","image-approval-ledger","visual-canonical-sync","repository-first-workspace","repository-human-projection","benchmark-preflight","benchmark-reverse-engineering","legacy-context-hygiene","legacy-sheet-migration"],"use_when":["등록된 기획 책임 원본을 작성·갱신·재구조화하고 발행 정책에 따라 파생본을 검수하며, 질문 전 기존 Decision·open/recent PR backlog·repository human projection을 대조하고 승인 결정을 repository 정본과 exact-SHA derived human view에 동기화한다. V4 Notion exception은 명시된 scope에서만 추가 destination이며 Google Sheets는 migration-only source다. 하위 시스템 checkpoint에서는 누적 승인 결정을 책임 원본과 필요한 human projection에 통합한다."],"do_not_use_when":["문서 구조·내용·발행 상태에 영향 없는 코드 수정 또는 CURRENT 발행본의 단순 조회다."],"learning_log":"skills/SKILL_LEARNING_LOG.md","review_triggers":["중복 책임 원본","문서 탐색 실패","상태 용어 충돌","PDF 생성 실패","입력 해시 불일치","시각 검수 실패","과도한 발행 강제","승인 결정 추적 누락","하위 시스템 통합 누락","댓글만으로 정본 갱신 완료 주장","대체 범위 누락","누적 결정과 책임 원본 불일치","중복 질문","승인 결정 즉시 정본화 누락","checkpoint까지 승인 승격 지연","Notion/repository 결정 sync 누락","Project Home human-facing 설명 누락","legacy Sheet active authority 부활"],"last_reviewed_at":"2026-08-19","last_reviewed_commit":"e8730f8f1804fa951260713f0e6d7f9220c62f4b","knowledge_state":"PATTERN"},{"skill_id":"maintaining-project-context-and-handoff","layer":"foundation","discipline":"project-operations","path":"skills/maintaining-project-context-and-handoff/SKILL.md","status":"ACTIVE","load_by_default":false,"trigger_tags":["handoff","active-context-change","phase-boundary","new-chat","godot-product-implementation-handoff","godot-work-instruction","godot-package-handoff","resume-godot-implementation","post-merge-reconcile","agent-merge","verified-pr-merge","actual-capability-gap","explicit-executor-handoff"],"use_when":["현재 상태의 재개·새 채팅/담당자 인수인계·Active Context 교정 또는 실제 실행 능력 부족·사용자 지정에 따른 구현 인계가 필요할 때. 같은 Work의 승인된 제품 코딩은 파일 확장자만으로 인계하지 않는다."],"do_not_use_when":["유효한 작업 계약으로 같은 Work에서 독립 구현·검증을 계속할 수 있고 상태 재개·실제 인계가 필요하지 않은 단일 변경. runtime 도구 부족만으로 가능한 코드·정적 검사를 중단하지 않는다."],"learning_log":"skills/maintaining-project-context-and-handoff/LEARNING_LOG.md","review_triggers":["콜드 스타트 실패","상태 불일치","코드 파일이라는 이유만으로 Codex owner로 분류","Godot 인계의 exact repository SHA 재수화 누락 또는 Notion 기본 의존 복원","승인 repository Visual path·SHA-256·manifest 확인 누락","CHANGE_PROPOSAL 없이 프로젝트 코어·UX·밸런스·서사·Art Direction 변경","stale project/worktree/session 사용","지정 Branch 밖 Push","검증 전 병합","승인 완료 항목 재승인 요구","실행 능력이 있는 Work의 강제 앱 전환","도구 능력을 새 사용자 승인으로 오인","runtime 미실행을 PASS로 보고","인계 단계에서 동일 후보 검토 2회 예산 초기화"],"last_reviewed_at":"2026-09-16","last_reviewed_commit":"d830c0f6967678eed3c208ac6b24f9cd1b262ec3","knowledge_state":"PATTERN"},{"skill_id":"analyzing-and-refining-game-concepts","layer":"specialist","discipline":"game-design-strategy","path":"skills/analyzing-and-refining-game-concepts/SKILL.md","status":"ACTIVE","load_by_default":false,"trigger_tags":["core-concept","pointed-fun","game-direction","benchmark-research","competitor-analysis","player-reviews","user-sentiment","playtest-design","telemetry-events","funnel-analysis","ab-testing","swot","mda","dde","digital-dopamine-design","rapid-reward","instant-feedback","reward-latency","poc","concept-recalibration","production-direction","evidence-pack","professional-official-evidence","game-system-design","system-boundary","difficulty-design","combat-ai-design","adaptive-difficulty","dynamic-difficulty-adjustment","attack-budget","threat-budget","tension-pacing","enemy-ai-fairness"],"use_when":["핵심 컨셉·뾰족한 재미·제약·DDD, 게임 시스템 경계, 난이도·전투 AI, 비교 게임·플레이어 반응·행동 근거·플레이테스트를 개선안과 PoC·재조정 방향으로 변환한다."],"do_not_use_when":["확정된 기획서의 단순 문장 편집, 단일 기능 구현, 출처 없는 인기 목록 수집, 이미 정의된 Vertical Slice 제작만 필요한 경우다."],"learning_log":"skills/SKILL_LEARNING_LOG.md","review_triggers":["핵심 컨셉과 기능 목록 혼동","벤치마크 기능 복사","리뷰 표본 편향","행동과 자기보고 혼동","여러 변수 동시 실험","PoC 범위 팽창","프레임워크 결과의 실행안 부재","DDD가 단순 자극으로 변질","첫 의미 있는 보상 시간 미측정","보상 인플레이션","외부 DDD 약어 오해","PoC 결과 미반영","benchmark-only decision","player response missing","professional evidence missing","system boundary missing","difficulty reduced to health scaling","unfair hidden information","player input cheating","attack budget missing","threat budget missing","tension pacing missing","success punished by scaling","adaptive difficulty oscillation","hysteresis missing"